category,title,creator,publication_year,description
movie,Chocolate Cowboy,Ezra Kub,1933,Voluptatibus vero nostrum quis.
book,Express Utopia,Kristofer Kihn IV,1923,Aut sequi commodi iusto.
movie,Brooklyn ,Mr. Magen Wyman,1955,Nesciunt ut repellat autem.
movie,Good-morning Delight,Ms. Samual Bergnaum,2003,Et qui cupiditate totam.
album,Dark Delight,Carita Farrell,1939,Veritatis maxime mollitia consectetur.
book,Jacked Cup,Deadra Brown,1976,Et ut magni laboriosam.
album,Pumpkin-spice Nuts,Matt Casper,1995,Eos sint eaque fuga.
book,Green Choice,Mike Vandervort,1946,Facilis dolore suscipit ipsam.
album,Brooklyn Light,Ms. Cara Kshlerin,2016,Corporis iusto qui voluptatem.
book,Heart Look,Joseph Von,1971,Qui beatae molestiae voluptatum.
movie,Green Look,Dr. Junior Corwin,1951,Labore minima aliquam non.
book,Evening Look,Bok Langworth Jr.,2009,Inventore ea possimus reprehenderit.
book,Seattle Star,Dr. Summer Schiller,1966,Molestias et velit qui.
album,Holiday Pie,Charleen Mills,1961,Modi ut itaque dignissimos.
album,Blacktop ,Micki Sporer,1923,Dicta illo voluptates earum.
album,Joe Forrester,Nga Feil,1980,Laboriosam esse deleniti quam.
book,Brooklyn Delight,Miss Isreal Hilpert,2003,Quibusdam sed molestias porro.
book,Goodbye Blend,Janna Blick,1974,Doloribus ut amet cum.
book,Summer Delight,Bud Swift PhD,2004,Et repellendus sapiente iste.
album,Seattle Breaker,Alejandro Stroman,1930,Rerum culpa consectetur sit.
book,Veranda Blend,Bruno Fahey,1936,Hic suscipit nam mollitia.
book,Thanksgiving Nuts,Mr. Kathlene Anderson,1941,Reiciendis inventore sapiente sit.
movie,Major Delight,Gilda Pacocha,1968,Libero et minus ut.
book,Wake-up Symphony,Mr. Shaun Larkin,1976,Aperiam quibusdam est qui.
album,Chocolate Cake,Gala Crooks,1977,Maxime quia sunt rerum.
