category,title,creator,publication_year,description
book,Spilt Select,Mai Schamberger,1970,Ad eos optio consectetur.
album,Joe Look,Wesley Stoltenberg,2003,Error consequatur fugiat ipsum.
album,KrebStar Blend,Glady Jakubowski,1970,Rerum animi quis itaque.
book,Blue Town,Lasonya Gulgowski,1986,Beatae voluptas quo neque.
album,Kreb-Full-o Light,Cherilyn Gusikowski,2014,Sed quia modi laudantium.
album,American Volcano,Twanda Nitzsche,1919,Nam est doloribus voluptas.
movie,Split Choice,Domonique Fadel,1986,Qui ipsa velit nam.
album,Dark Nuts,Mr. Loren Bayer,1936,Et dignissimos et eaque.
movie,Reg's Choice,Stefan Gleichner,1991,Blanditiis cupiditate tempore nemo.
book,Chocolate Enlightenment,Miss Wiley Effertz,1935,Quidem reprehenderit odit laboriosam.
movie,The Java,Wilbert Collins V,2011,Et tenetur rerum nemo.
movie,Brooklyn Equinox,Johanna Greenfelder,1974,Quasi cupiditate qui vel.
album,American Mug,Elroy Jones,2018,Excepturi est et sunt.
album,Evening Java,Kraig King V,1943,Odio eos impedit laborum.
album,Pumpkin-spice Extract,Ethan Von,2000,Et nemo non ratione.
movie,Dark Choice,Dr. Zenia Daniel,1944,Eius perferendis ex omnis.
book,Brooklyn Java,Abram Prohaska,2012,Ipsa ut dolores blanditiis.
album,Cascara Breaker,Grisel Bogan,1948,Voluptatibus illum consequatur esse.
album,Street Breaker,Eliseo Cummerata,1925,Et doloribus saepe accusantium.
book,Bluebery Volcano,Agustin Rodriguez,2000,Quidem velit laborum architecto.
movie,Huggy Look,Andre Stanton,2011,Quos id non dignissimos.
book,Strong Mug,Isela Nicolas,1967,Aliquam alias laudantium modi.
movie,Evening Town,Linh Luettgen,1939,Atque enim beatae mollitia.
book,Thanksgiving Utopia,Alfred Dickinson,1950,Eligendi excepturi sed vitae.
book,Winter Volcano,Tanya Padberg,1961,Ipsum laborum sunt tempore.
