category,title,creator,publication_year,description
book,Melty Been,Janell Runolfsson,1932,Labore soluta distinctio maiores.
book,Jacked Cup,Patrick Barton III,1975,Sed optio et omnis.
album,Melty Breaker,Erlene Wiza Jr.,1944,Qui expedita officia nam.
album,Pumpkin-spice Forrester,Antony Schaefer,1960,Aut eum dolor suscipit.
album,Split Nuts,Barrie Considine DDS,1959,Nulla non autem quidem.
book,Pumpkin-spice Cup,Hilton Lueilwitz,1943,Deleniti in ipsa excepturi.
album,Jacked Choice,Julio Altenwerth V,1976,Adipisci exercitationem quaerat placeat.
book,Strong Choice,Miss Dominick Miller,1963,Voluptatem id dicta omnis.
album,Reg's Solstice,Mariela Swaniawski,1996,Omnis eius sit et.
album,Chocolate Cup,Janis Pouros,1920,Qui deleniti neque reiciendis.
book,Split Extract,William Rolfson,1922,Exercitationem id et voluptates.
book,Morning America,Jed Torphy,1989,Impedit ratione optio iste.
book,Red Equinox,Randell Fisher,1920,Odit vel eos voluptatem.
book,Chocolate Coffee,Oralee Bashirian,1968,Aut accusamus aut sed.
album,Chocolate Breaker,Santo Schinner,1965,Est ut dolor quidem.
album,Hello Been,Moises Crist I,1986,Aut dolor pariatur molestias.
album,Melty Town,Man Cormier,1979,Suscipit quis quam omnis.
book,Captain's Volcano,Drew Jenkins,1991,Porro omnis molestias at.
book,Heart Look,Miss Tracee Zboncak,1956,Reiciendis qui et animi.
book,Cascara Choice,Merle West,1953,Et vel quia eos.
book,Joe Nuts,Julian Armstrong,1976,Voluptatem sed ipsam repellat.
album,The Captain's Star,Shad Hickle,1966,Quo et numquam quia.
album,Spilt Java,Bryon Wuckert,1963,Omnis et sed quis.
book,KrebStar Look,Mrs. Trudy Lind,1920,Ab velit dolores quia.
book,Split Mug,Rocco Weissnat MD,2016,Dicta sed similique consequatur.
